{
  "agent": "claude",
  "chorus_output_version": 1,
  "cwd": "/workspace/demo",
  "duration_estimate": null,
  "files_referenced": [],
  "last_response_snippet": "Claude fixture assistant output.",
  "message_count": 1,
  "session_id": "session-claude-fixture-0001",
  "source": "session-claude-fixture-0001.jsonl",
  "tool_calls_by_type": {},
  "user_requests": [],
  "warnings": []
}
