{
  "agent": "gemini",
  "chorus_output_version": 1,
  "cwd": "/workspace/demo",
  "duration_estimate": null,
  "files_referenced": [],
  "last_response_snippet": "Gemini fixture assistant output.",
  "message_count": 1,
  "session_id": "session-gemini-fixture-0001",
  "source": "session-gemini-fixture-0001.json",
  "tool_calls_by_type": {},
  "user_requests": [
    "hello"
  ],
  "warnings": []
}
